{
  "agency_count": 22,
  "average_score": 55.1,
  "common_fixes": [
    {
      "agencies": 14,
      "code": "scorecard_wheelchair_boarding_unknown",
      "fix": "Set wheelchair_boarding to 1 (accessible) or 2 (not accessible) for every stop. A field survey can start with the busiest stops."
    },
    {
      "agencies": 14,
      "code": "scorecard_wheelchair_accessible_unknown",
      "fix": "Set wheelchair_accessible on every trip (most small-agency fleets are 100% accessible, so this is often a single default)."
    },
    {
      "agencies": 13,
      "code": "scorecard_feed_expired",
      "fix": "Re-export the feed with a calendar that reaches further out, and set feed_info feed_end_date past your next service change."
    },
    {
      "agencies": 11,
      "code": "scorecard_no_fare_data",
      "fix": "Add fare_attributes.txt (or Fares v2 files) with your fare structure. If your service is fare-free, ask to have it marked fare-free instead."
    },
    {
      "agencies": 2,
      "code": "scorecard_missing_headsigns",
      "fix": "Populate trip_headsign to match what the bus displays."
    },
    {
      "agencies": 2,
      "code": "unused_shape",
      "fix": "Enable 'remove unused shapes' (or similar) in your export tool."
    }
  ],
  "expired": {
    "lapsed": 3,
    "stale": 10,
    "total": 13
  },
  "generated_at": "2026-07-08T06:56:33+00:00",
  "grade_distribution": {
    "B": 2,
    "C": 3,
    "D": 2,
    "F": 15
  },
  "members": [
    {
      "annual_trips": null,
      "attention_reason": "Service data has expired",
      "days_until_expiry": -675,
      "expiry_status": "stale",
      "grade": "F",
      "id": "kalamazoo-metro-transit-2070",
      "name": "Kalamazoo Metro Transit",
      "needs_attention": true,
      "score": 31.4,
      "shapes_status": null,
      "snapshot_date": "2026-07-08",
      "top_fix": "Re-export the feed with a calendar that reaches further out, and set feed_info feed_end_date past your next service change."
    },
    {
      "annual_trips": null,
      "attention_reason": "Service data has expired",
      "days_until_expiry": -1159,
      "expiry_status": "stale",
      "grade": "F",
      "id": "kalamazoo-metro-transit",
      "name": "Kalamazoo Metro Transit",
      "needs_attention": true,
      "score": 31.8,
      "shapes_status": "ready",
      "snapshot_date": "2026-07-08",
      "top_fix": "Re-export the feed with a calendar that reaches further out, and set feed_info feed_end_date past your next service change."
    },
    {
      "annual_trips": null,
      "attention_reason": "Service window shortened unexpectedly on 2026-07-07",
      "days_until_expiry": -5,
      "expiry_status": "lapsed",
      "grade": "F",
      "id": "detroit-department-of-transportation-ddot",
      "name": "Detroit Department of Transportation (DDOT)",
      "needs_attention": true,
      "score": 36.0,
      "shapes_status": "ready",
      "snapshot_date": "2026-07-08",
      "top_fix": "Re-export the feed with a calendar that reaches further out, and set feed_info feed_end_date past your next service change."
    },
    {
      "annual_trips": null,
      "attention_reason": "Service data has expired",
      "days_until_expiry": -1642,
      "expiry_status": "stale",
      "grade": "F",
      "id": "bay-area-transportation-authority",
      "name": "Bay Area Transportation Authority",
      "needs_attention": true,
      "score": 44.6,
      "shapes_status": null,
      "snapshot_date": "2026-07-08",
      "top_fix": "Re-export the feed with a calendar that reaches further out, and set feed_info feed_end_date past your next service change."
    },
    {
      "annual_trips": null,
      "attention_reason": "Service data has expired",
      "days_until_expiry": -1642,
      "expiry_status": "stale",
      "grade": "F",
      "id": "bay-area-transportation-authority-223",
      "name": "Bay Area Transportation Authority",
      "needs_attention": true,
      "score": 44.6,
      "shapes_status": null,
      "snapshot_date": "2026-07-08",
      "top_fix": "Re-export the feed with a calendar that reaches further out, and set feed_info feed_end_date past your next service change."
    },
    {
      "annual_trips": null,
      "attention_reason": "Service data has expired",
      "days_until_expiry": -2381,
      "expiry_status": "stale",
      "grade": "F",
      "id": "mass-transportation-authority-flint",
      "name": "Mass Transportation Authority Flint",
      "needs_attention": true,
      "score": 45.6,
      "shapes_status": null,
      "snapshot_date": "2026-07-08",
      "top_fix": "Re-export the feed with a calendar that reaches further out, and set feed_info feed_end_date past your next service change."
    },
    {
      "annual_trips": null,
      "attention_reason": "Service data has expired",
      "days_until_expiry": -1530,
      "expiry_status": "stale",
      "grade": "F",
      "id": "university-of-michigan-transit-services",
      "name": "University of Michigan Transit Services",
      "needs_attention": true,
      "score": 48.6,
      "shapes_status": null,
      "snapshot_date": "2026-07-08",
      "top_fix": "Re-export the feed with a calendar that reaches further out, and set feed_info feed_end_date past your next service change."
    },
    {
      "annual_trips": null,
      "attention_reason": "Service data has expired",
      "days_until_expiry": -189,
      "expiry_status": "lapsed",
      "grade": "F",
      "id": "qline-detroit",
      "name": "Qline Detroit",
      "needs_attention": true,
      "score": 50.4,
      "shapes_status": null,
      "snapshot_date": "2026-07-08",
      "top_fix": "Re-export the feed with a calendar that reaches further out, and set feed_info feed_end_date past your next service change."
    },
    {
      "annual_trips": null,
      "attention_reason": "Service data has expired",
      "days_until_expiry": -189,
      "expiry_status": "lapsed",
      "grade": "F",
      "id": "qline-detroit-802",
      "name": "Qline Detroit",
      "needs_attention": true,
      "score": 50.4,
      "shapes_status": null,
      "snapshot_date": "2026-07-08",
      "top_fix": "Re-export the feed with a calendar that reaches further out, and set feed_info feed_end_date past your next service change."
    },
    {
      "annual_trips": null,
      "attention_reason": "Service data has expired",
      "days_until_expiry": -554,
      "expiry_status": "stale",
      "grade": "F",
      "id": "indian-trails-detroit-ann-arbor-express",
      "name": "Indian Trails, Detroit Ann Arbor Express",
      "needs_attention": true,
      "score": 56.1,
      "shapes_status": null,
      "snapshot_date": "2026-07-08",
      "top_fix": "Re-export the feed with a calendar that reaches further out, and set feed_info feed_end_date past your next service change."
    },
    {
      "annual_trips": null,
      "attention_reason": "Service data has expired",
      "days_until_expiry": -554,
      "expiry_status": "stale",
      "grade": "F",
      "id": "indian-trails-detroit-ann-arbor-express-384",
      "name": "Indian Trails, Detroit Ann Arbor Express",
      "needs_attention": true,
      "score": 56.1,
      "shapes_status": null,
      "snapshot_date": "2026-07-08",
      "top_fix": "Re-export the feed with a calendar that reaches further out, and set feed_info feed_end_date past your next service change."
    },
    {
      "annual_trips": null,
      "attention_reason": "Service data has expired",
      "days_until_expiry": -495,
      "expiry_status": "stale",
      "grade": "F",
      "id": "michigan-flyer",
      "name": "Michigan Flyer",
      "needs_attention": true,
      "score": 57.3,
      "shapes_status": null,
      "snapshot_date": "2026-07-08",
      "top_fix": "Re-export the feed with a calendar that reaches further out, and set feed_info feed_end_date past your next service change."
    },
    {
      "annual_trips": null,
      "attention_reason": "Service data has expired",
      "days_until_expiry": -495,
      "expiry_status": "stale",
      "grade": "F",
      "id": "michigan-flyer-413",
      "name": "Michigan Flyer",
      "needs_attention": true,
      "score": 57.3,
      "shapes_status": null,
      "snapshot_date": "2026-07-08",
      "top_fix": "Re-export the feed with a calendar that reaches further out, and set feed_info feed_end_date past your next service change."
    },
    {
      "annual_trips": null,
      "attention_reason": "Service data expires in 46 day(s)",
      "days_until_expiry": 46,
      "expiry_status": "current",
      "grade": "D",
      "id": "capital-area-transportation-authority-cata",
      "name": "Capital Area Transportation Authority (CATA)",
      "needs_attention": true,
      "score": 64.9,
      "shapes_status": null,
      "snapshot_date": "2026-07-08",
      "top_fix": "Set wheelchair_boarding to 1 (accessible) or 2 (not accessible) for every stop. A field survey can start with the busiest stops."
    },
    {
      "annual_trips": null,
      "attention_reason": "Service data expires in 53 day(s)",
      "days_until_expiry": 53,
      "expiry_status": "current",
      "grade": "D",
      "id": "the-rapid",
      "name": "The Rapid",
      "needs_attention": true,
      "score": 69.6,
      "shapes_status": null,
      "snapshot_date": "2026-07-08",
      "top_fix": "Set wheelchair_boarding to 1 (accessible) or 2 (not accessible) for every stop. A field survey can start with the busiest stops."
    },
    {
      "annual_trips": null,
      "attention_reason": "Service data expires in 45 day(s)",
      "days_until_expiry": 45,
      "expiry_status": "current",
      "grade": "C",
      "id": "ann-arbor-area-transportation-authority-theride",
      "name": "Ann Arbor Area Transportation Authority (TheRide)",
      "needs_attention": true,
      "score": 70.5,
      "shapes_status": null,
      "snapshot_date": "2026-07-08",